{"version":"0.1.0","subject":"italian","school_stage":"middle_school","curriculum_profile":"italy-middle-school-italian-2026-transition","typical_year":3,"sequencing_note":"Sequenza tipica TutorLab, non prescrittiva. Il motore può scendere ai prerequisiti e ritornare all'obiettivo in base alle evidenze.","nodes":[{"id":"ita.oral.argumentation","title":"Argomentare oralmente","strand":"oral","typical_year":3,"priority":"gateway","prerequisites":["ita.oral.discussion-opinion"],"objectives":["Sostenere una tesi con argomenti ed esempi","Considerare una possibile obiezione e rispondere"],"mastery_evidence":["Tesi, ragioni e conclusione sono riconoscibili","Distingue esempio da argomento"],"diagnostic_signals":["Accumula opinioni","Attacca la persona anziché l'idea"],"difficulty_levers":["numero argomenti","controargomento","spontaneità"]},{"id":"ita.oral.formal-exposition","title":"Esposizione orale formale e disciplinare","strand":"oral","typical_year":3,"priority":"core","prerequisites":["ita.oral.prepared-exposition","ita.study.source-synthesis"],"objectives":["Organizzare un'esposizione di studio con lessico disciplinare","Integrare appunti o supporti visivi senza leggerli"],"mastery_evidence":["Mantiene struttura e registro","Spiega termini specifici quando necessario"],"diagnostic_signals":["Legge slide o appunti","Passa a registro colloquiale nei punti difficili"],"difficulty_levers":["durata","supporti","densità concettuale"]},{"id":"ita.reading.argumentative","title":"Comprendere testi argomentativi","strand":"reading","typical_year":3,"priority":"gateway","prerequisites":["ita.reading.inference"],"objectives":["Individuare tesi, argomenti, esempi e obiezioni","Valutare se una conclusione è sostenuta dal testo"],"mastery_evidence":["Ricostruisce la struttura argomentativa","Distingue dato, opinione ed esempio"],"diagnostic_signals":["Scambia tema per tesi","Accetta ogni affermazione come prova"],"difficulty_levers":["argomenti impliciti","distrattori","lunghezza"]},{"id":"ita.reading.literary-interpretation","title":"Interpretare testi letterari","strand":"reading","typical_year":3,"priority":"core","prerequisites":["ita.text.genre-analysis","ita.text.poetry-figures"],"objectives":["Formulare interpretazioni fondate su elementi testuali","Collegare forma, voce, immagini e tema"],"mastery_evidence":["Cita dettagli pertinenti","Distingue interpretazione da semplice riassunto"],"diagnostic_signals":["Interpretazione senza prove","Parafrasi al posto dell'analisi"],"difficulty_levers":["ambiguità","distanza storica","densità stilistica"]},{"id":"ita.reading.source-comparison","title":"Confrontare fonti e punti di vista","strand":"reading","typical_year":3,"priority":"gateway","prerequisites":["ita.study.source-synthesis"],"objectives":["Confrontare affidabilità, scopo e prospettiva di fonti accessibili","Rilevare accordi, divergenze e omissioni"],"mastery_evidence":["Motiva il confronto con elementi osservabili","Non confonde autorevolezza e accordo con la propria opinione"],"diagnostic_signals":["Giudica dalla grafica soltanto","Confonde differenza con errore"],"difficulty_levers":["numero fonti","conflitto","provenienza"]},{"id":"ita.writing.argumentative","title":"Scrivere un testo argomentativo","strand":"writing","typical_year":3,"priority":"gateway","prerequisites":["ita.reading.argumentative","ita.oral.argumentation"],"objectives":["Formulare tesi, argomenti, esempi e conclusione","Usare connettivi logici e considerare un'obiezione"],"mastery_evidence":["La tesi è sostenuta da ragioni pertinenti","Il testo anticipa o gestisce almeno una posizione alternativa"],"diagnostic_signals":["Tesi assente","Esempi senza legame logico"],"difficulty_levers":["numero argomenti","fonti","controargomento"]},{"id":"ita.writing.personal-reflective","title":"Scrittura personale e riflessiva","strand":"writing","typical_year":3,"priority":"core","prerequisites":["ita.writing.narrative","ita.vocabulary.register-semantics"],"objectives":["Collegare esperienza e riflessione","Mantenere coerenza tra voce, registro e scopo"],"mastery_evidence":["Distingue racconto e commento riflessivo","Sviluppa un'idea oltre la semplice cronaca"],"diagnostic_signals":["Elenco di eventi","Generalizzazioni non collegate all'esperienza"],"difficulty_levers":["grado di astrazione","vincolo tematico","registro"]},{"id":"ita.writing.revision-cohesion","title":"Revisione avanzata: coerenza e coesione","strand":"writing","typical_year":3,"priority":"gateway","prerequisites":["ita.learning.revision","ita.grammar.pronouns-connectives"],"objectives":["Rivedere struttura dei paragrafi, referenti e connettivi","Ridurre ripetizioni e ambiguità senza impoverire il testo"],"mastery_evidence":["Spiega perché una revisione migliora il testo","Individua incoerenze globali oltre agli errori locali"],"diagnostic_signals":["Corregge solo superficie","Sostituisce parole senza verificare il significato"],"difficulty_levers":["lunghezza testo","numero livelli di revisione","tempo"]},{"id":"ita.grammar.complex-sentence","title":"Analisi del periodo","strand":"grammar","typical_year":3,"priority":"gateway","prerequisites":["ita.grammar.coordination-subordination-intro"],"objectives":["Individuare principale, coordinate e subordinate in periodi di media complessità","Rappresentare i rapporti gerarchici tra proposizioni"],"mastery_evidence":["Segmenta correttamente il periodo","Ricostruisce la dipendenza logica e sintattica"],"diagnostic_signals":["Conta verbi ma non gerarchie","Tratta tutte le subordinate come equivalenti"],"difficulty_levers":["numero livelli","forme implicite","ordine marcato"]},{"id":"ita.grammar.subordination","title":"Tipi e funzioni delle subordinate","strand":"grammar","typical_year":3,"priority":"core","prerequisites":["ita.grammar.complex-sentence"],"objectives":["Riconoscere principali subordinate completive, relative e circostanziali","Collegare funzione e significato"],"mastery_evidence":["Classifica usando il ruolo nella frase","Distingue subordinate formalmente simili ma funzionalmente diverse"],"diagnostic_signals":["Usa solo la congiunzione come indizio","Confonda causa e fine"],"difficulty_levers":["ambiguità","forme implicite","polisemia connettivi"]},{"id":"ita.grammar.register-standard-usage","title":"Norma, uso e registro","strand":"grammar","typical_year":3,"priority":"core","prerequisites":["ita.vocabulary.register-semantics"],"objectives":["Distinguere errore, variante e scelta di registro in casi accessibili","Adattare strutture sintattiche e lessico alla situazione"],"mastery_evidence":["Motiva una correzione o una scelta di registro","Riconosce che non tutte le differenze dall'uso formale sono errori assoluti"],"diagnostic_signals":["Ipercorrezione","Confusione tra colloquiale e scorretto"],"difficulty_levers":["contesto","variazione","grado di formalità"]},{"id":"ita.vocabulary.disciplinary-lexis","title":"Lessico disciplinare e precisione semantica","strand":"vocabulary","typical_year":3,"priority":"gateway","prerequisites":["ita.vocabulary.register-semantics"],"objectives":["Comprendere e usare termini di studio in modo preciso","Evitare parole generiche quando il contesto richiede specificità"],"mastery_evidence":["Definisce termini con parole proprie","Usa il termine corretto in una spiegazione"],"diagnostic_signals":["Memorizza definizioni senza saper usare il termine","Sostituisce con parole troppo generiche"],"difficulty_levers":["astrazione","polisemia","disciplina"]},{"id":"ita.text.literary-analysis","title":"Analisi integrata del testo letterario","strand":"text_analysis","typical_year":3,"priority":"gateway","prerequisites":["ita.reading.literary-interpretation"],"objectives":["Integrare struttura, lingua, figure e temi","Confrontare testi o passaggi motivando somiglianze e differenze"],"mastery_evidence":["Costruisce un'analisi sostenuta da prove","Collega scelta formale ed effetto"],"diagnostic_signals":["Catalogo di figure senza interpretazione","Giudizio personale senza testo"],"difficulty_levers":["genere","distanza culturale","numero livelli analisi"]},{"id":"ita.study.synthesis-citation","title":"Sintesi, parafrasi e uso responsabile delle fonti","strand":"study_strategy","typical_year":3,"priority":"gateway","prerequisites":["ita.study.source-synthesis","ita.reading.source-comparison"],"objectives":["Integrare informazioni indicando la provenienza","Parafrasare senza alterare il significato e distinguere parole proprie da citazione"],"mastery_evidence":["Produce sintesi tracciabile alle fonti","Evita copia estesa non segnalata"],"diagnostic_signals":["Perde la provenienza","Parafrasi troppo vicina all'originale"],"difficulty_levers":["numero fonti","conflitto","densità"]},{"id":"ita.learning.metalinguistic-reflection","title":"Riflessione metalinguistica e strategie","strand":"study_strategy","typical_year":3,"priority":"core","prerequisites":["ita.grammar.complex-sentence","ita.writing.revision-cohesion"],"objectives":["Usare categorie grammaticali per risolvere problemi reali di comprensione o scrittura","Scegliere una strategia di revisione in base al tipo di errore"],"mastery_evidence":["Spiega quale conoscenza linguistica usa e perché","Trasferisce la strategia a un testo nuovo"],"diagnostic_signals":["Analisi grammaticale fine a sé stessa","Strategia scelta per abitudine"],"difficulty_levers":["novità del testo","tipo errore","autonomia"]}]}
