{"version":"0.1.0","subject":"french","school_stage":"middle_school","curriculum_profile":"italy-middle-school-french-a1-2026-transition","typical_year":1,"sequencing_note":"Sequenza tipica TutorLab, non prescrittiva. Il motore può scendere ai prerequisiti e ritornare all'obiettivo in base alle evidenze.","nodes":[{"id":"fr.grammar.identity-possession","title":"être e avoir: identità, stato e possesso","strand":"grammar","typical_year":1,"priority":"gateway","prerequisites":[],"objectives":["Usare être e avoir in frasi personali semplici","Formare affermazioni, negazioni e domande frequenti"],"mastery_evidence":["Distingue le due funzioni in contesto","Risponde a domande personali senza traduzione parola per parola"],"diagnostic_signals":["Confusione tra verbi di identità/stato e possesso","Ordine interrogativo instabile"],"difficulty_levers":["persona grammaticale","forma interrogativa","uso comunicativo"],"cefr_anchor":"A1","progression_stage":"A1_foundation"},{"id":"fr.grammar.nominal-basics","title":"articles, genre et nombre","strand":"grammar","typical_year":1,"priority":"gateway","prerequisites":[],"objectives":["Usare articoli e accordo di genere/numero ad alta frequenza","Riconoscere plurali e forme irregolari frequenti"],"mastery_evidence":["Accordo corretto in frasi semplici","Seleziona articolo coerente con il nome"],"diagnostic_signals":["Trasferisce meccanicamente l'italiano","Accordo incoerente"],"difficulty_levers":["irregolarità","numero di accordi","produzione"],"cefr_anchor":"A1","progression_stage":"A1_foundation"},{"id":"fr.grammar.present-regular","title":"présent des verbes réguliers","strand":"grammar","typical_year":1,"priority":"gateway","prerequisites":["fr.grammar.identity-possession"],"objectives":["Descrivere routine e fatti presenti","Gestire persone grammaticali e negazione"],"mastery_evidence":["Produce forme frequenti senza supporto","Usa il presente in brevi scambi autentici"],"diagnostic_signals":["Omette desinenze o soggetto quando necessario","Mischia paradigmi"],"difficulty_levers":["persona","regolarità","spontaneità"],"cefr_anchor":"A1","progression_stage":"A1_foundation"},{"id":"fr.grammar.questions-negation","title":"questions et négation","strand":"grammar","typical_year":1,"priority":"core","prerequisites":["fr.grammar.present-regular"],"objectives":["Chiedere informazioni personali e quotidiane","Negare frasi semplici in modo stabile"],"mastery_evidence":["Formula domande comprensibili","Risponde usando la polarità corretta"],"diagnostic_signals":["Ordine influenzato dall'italiano","Negazione incompleta"],"difficulty_levers":["tipo domanda","registro","velocità"],"cefr_anchor":"A1","progression_stage":"A1_foundation"},{"id":"fr.vocabulary.personal-family","title":"Lessico: identità, famiglia e descrizione personale","strand":"vocabulary","typical_year":1,"priority":"gateway","prerequisites":[],"objectives":["Comprendere e usare lessico personale ad alta frequenza","Descrivere persone con parole semplici"],"mastery_evidence":["Recupera lessico senza lista bilingue","Comprende parafrasi elementari"],"diagnostic_signals":["Riconosce solo parole isolate","Dipende dalla traduzione"],"difficulty_levers":["supporto visivo","frequenza","produzione"],"cefr_anchor":"A1","progression_stage":"A1_foundation"},{"id":"fr.vocabulary.school-time","title":"Lessico: scuola, numeri, date e orari","strand":"vocabulary","typical_year":1,"priority":"core","prerequisites":["fr.vocabulary.personal-family"],"objectives":["Parlare di materie, oggetti, giorni e orari","Comprendere numeri e date in contesto"],"mastery_evidence":["Comunica un orario o una data correttamente","Comprende istruzioni scolastiche semplici"],"diagnostic_signals":["Confusione numeri simili","Ricorda termini solo in elenco"],"difficulty_levers":["velocità","formato ora/data","rumore contestuale"],"cefr_anchor":"A1","progression_stage":"A1_foundation"},{"id":"fr.vocabulary.home-town","title":"Lessico: casa, città e luoghi familiari","strand":"vocabulary","typical_year":1,"priority":"core","prerequisites":["fr.vocabulary.personal-family"],"objectives":["Descrivere casa e quartiere","Comprendere preposizioni spaziali di base"],"mastery_evidence":["Localizza oggetti o luoghi","Produce una breve descrizione spaziale"],"diagnostic_signals":["Conosce il nome ma non la relazione spaziale","Traduzione letterale delle preposizioni"],"difficulty_levers":["mappa/testo","numero luoghi","precisione"],"cefr_anchor":"A1","progression_stage":"A1_foundation"},{"id":"fr.phonology.foundation","title":"alphabet, accents et correspondances graphie-son","strand":"phonology","typical_year":1,"priority":"gateway","prerequisites":[],"objectives":["Associare grafia e suono in parole frequenti","Fare e comprendere spelling di informazioni semplici"],"mastery_evidence":["Pronuncia comprensibile parole note","Trascrive nomi o parole scandite lentamente"],"diagnostic_signals":["Pronuncia italianizzata impedisce il riconoscimento","Confusione di grafemi simili"],"difficulty_levers":["lunghezza parola","velocità","contrasto suoni"],"cefr_anchor":"A1","progression_stage":"A1_foundation"},{"id":"fr.reading.basic-info","title":"Reading A1 iniziale: informazioni esplicite","strand":"reading","typical_year":1,"priority":"gateway","prerequisites":["fr.vocabulary.personal-family"],"objectives":["Comprendere profili, avvisi e messaggi molto brevi","Individuare informazioni personali e pratiche"],"mastery_evidence":["Trova dati espliciti senza tradurre tutto","Riconosce lo scopo generale"],"diagnostic_signals":["Traduzione parola per parola","Si blocca su una parola sconosciuta"],"difficulty_levers":["lunghezza","parole trasparenti","distrattori"],"cefr_anchor":"A1","progression_stage":"A1_foundation"},{"id":"fr.listening.basic-info","title":"Listening A1 iniziale: informazioni esplicite","strand":"listening","typical_year":1,"priority":"gateway","prerequisites":["fr.phonology.foundation","fr.vocabulary.personal-family"],"objectives":["Comprendere informazioni personali pronunciate lentamente","Riconoscere numeri, nomi, luoghi e orari frequenti"],"mastery_evidence":["Seleziona informazioni chiave dopo uno o due ascolti","Non richiede trascrizione completa"],"diagnostic_signals":["Conosce la parola scritta ma non la riconosce","Perde il senso dopo una parola ignota"],"difficulty_levers":["velocità","numero parlanti","ridondanza"],"cefr_anchor":"A1","progression_stage":"A1_foundation"},{"id":"fr.interaction.personal-exchange","title":"Interazione: presentarsi e scambiare informazioni personali","strand":"interaction","typical_year":1,"priority":"gateway","prerequisites":["fr.grammar.questions-negation","fr.vocabulary.personal-family"],"objectives":["Presentarsi, salutare, chiedere e rispondere su dati personali","Usare formule di cortesia essenziali"],"mastery_evidence":["Sostiene più turni brevi","Fa almeno una domanda pertinente"],"diagnostic_signals":["Recita un monologo senza interagire","Passa subito all'italiano"],"difficulty_levers":["numero turni","spontaneità","supporto"],"cefr_anchor":"A1","progression_stage":"A1_foundation"},{"id":"fr.writing.profile-message","title":"Scrittura: profilo e messaggio breve","strand":"writing","typical_year":1,"priority":"core","prerequisites":["fr.grammar.present-regular","fr.vocabulary.personal-family"],"objectives":["Scrivere frasi collegate su di sé o una persona","Compilare un messaggio breve con informazioni richieste"],"mastery_evidence":["Copre i punti richiesti","Mantiene accordi e forme di base sufficientemente comprensibili"],"diagnostic_signals":["Frasi isolate senza legame","Omissione di informazioni"],"difficulty_levers":["numero punti","supporto modello","autonomia"],"cefr_anchor":"A1","progression_stage":"A1_foundation"},{"id":"fr.mediation.relay-basic","title":"Mediazione: riferire informazioni semplici","strand":"mediation","typical_year":1,"priority":"core","prerequisites":["fr.reading.basic-info"],"objectives":["Trasmettere a un'altra persona poche informazioni pratiche","Selezionare ciò che serve al destinatario"],"mastery_evidence":["Riferisce i dati essenziali senza copiare tutto","Adatta la forma allo scopo"],"diagnostic_signals":["Copia integrale","Aggiunge informazioni non presenti"],"difficulty_levers":["numero dati","cambio lingua","scopo"],"cefr_anchor":"A1","progression_stage":"A1_foundation"},{"id":"fr.learning.repair-basics","title":"Strategie: chiedere chiarimento e mantenere lo scambio","strand":"learning_strategy","typical_year":1,"priority":"core","prerequisites":["fr.interaction.personal-exchange"],"objectives":["Usare formule per chiedere ripetizione o chiarimento","Compensare una parola mancante con gesto o parafrasi elementare"],"mastery_evidence":["Non interrompe automaticamente lo scambio","Sceglie una strategia pertinente"],"diagnostic_signals":["Abbandona il compito","Passa alla L1 senza tentativo"],"difficulty_levers":["pressione tempo","lessico mancante","interlocutore"],"cefr_anchor":"A1","progression_stage":"A1_foundation"},{"id":"fr.intercultural.awareness","title":"Consapevolezza interculturale iniziale","strand":"intercultural","typical_year":1,"priority":"supporting","prerequisites":[],"objectives":["Osservare esempi di pratiche quotidiane in contesti francesefoni","Descrivere somiglianze e differenze senza generalizzare"],"mastery_evidence":["Usa formulazioni limitate all'esempio","Distingue osservazione e stereotipo"],"diagnostic_signals":["Generalizza da un singolo caso","Valuta invece di descrivere"],"difficulty_levers":["familiarità","numero contesti","supporto"],"cefr_anchor":"A1","progression_stage":"A1_foundation"}],"target_cefr":"A1"}
