{"version":"0.1.0","subject":"french","school_stage":"middle_school","curriculum_profile":"italy-middle-school-french-a1-2026-transition","typical_year":2,"sequencing_note":"Sequenza tipica TutorLab, non prescrittiva. Il motore può scendere ai prerequisiti e ritornare all'obiettivo in base alle evidenze.","nodes":[{"id":"fr.grammar.present-irregular","title":"verbes fréquents irréguliers","strand":"grammar","typical_year":2,"priority":"gateway","prerequisites":["fr.grammar.present-regular"],"objectives":["Usare i principali verbi irregolari ad alta frequenza","Stabilizzare forme in routine e preferenze"],"mastery_evidence":["Produce forme frequenti in contesto","Mantiene correttezza in domande/negazioni"],"diagnostic_signals":["Regolarizza forme irregolari","Conosce la forma isolata ma la perde nel discorso"],"difficulty_levers":["frequenza","persona","interazione"],"cefr_anchor":"A1","progression_stage":"A1_developing"},{"id":"fr.grammar.possessives-demonstratives","title":"Possessivi, dimostrativi e riferimenti","strand":"grammar","typical_year":2,"priority":"core","prerequisites":["fr.grammar.nominal-basics"],"objectives":["Esprimere possesso e riferimento spaziale/personale","Mantenere accordi essenziali"],"mastery_evidence":["Referenti chiari","Seleziona forma coerente col contesto"],"diagnostic_signals":["Ambiguità del referente","Accordo meccanico"],"difficulty_levers":["numero referenti","distanza","genere/numero"],"cefr_anchor":"A1","progression_stage":"A1_developing"},{"id":"fr.grammar.future-modality","title":"futur proche","strand":"grammar","typical_year":2,"priority":"gateway","prerequisites":["fr.grammar.present-irregular"],"objectives":["Parlare di progetti e intenzioni semplici","Formulare proposte o intenzioni immediate"],"mastery_evidence":["Distingue presente e piano futuro dal contesto","Produce una breve sequenza di progetto"],"diagnostic_signals":["Usa sempre il presente senza riferimento temporale","Costruzione incompleta"],"difficulty_levers":["orizzonte temporale","numero azioni","spontaneità"],"cefr_anchor":"A1","progression_stage":"A1_developing"},{"id":"fr.grammar.past-intro","title":"passé composé","strand":"grammar","typical_year":2,"priority":"supporting","prerequisites":["fr.grammar.present-irregular"],"objectives":["Riferire esperienze o azioni passate in forma introduttiva e ad alta frequenza","Comprendere marcatori temporali essenziali"],"mastery_evidence":["Colloca correttamente eventi semplici nel passato","Comprende brevi messaggi su esperienza recente"],"diagnostic_signals":["Mischia presente/passato senza criterio","Sceglie la forma per parola segnale soltanto"],"difficulty_levers":["regolarità","marcatori","numero eventi"],"cefr_anchor":"A1","progression_stage":"A1_developing"},{"id":"fr.vocabulary.routines-free-time","title":"Lessico: routine, tempo libero e preferenze","strand":"vocabulary","typical_year":2,"priority":"core","prerequisites":["fr.vocabulary.school-time"],"objectives":["Ampliare verbi e nomi per attività quotidiane","Esprimere gusti e frequenza"],"mastery_evidence":["Parla di una settimana con varietà sufficiente","Comprende preferenze in dialoghi brevi"],"diagnostic_signals":["Lessico ridotto blocca la frase","Ripetizione dello stesso verbo"],"difficulty_levers":["ampiezza","recupero","contesto"],"cefr_anchor":"A1","progression_stage":"A1_developing"},{"id":"fr.vocabulary.food-shopping","title":"Lessico: cibo, quantità e acquisti","strand":"vocabulary","typical_year":2,"priority":"gateway","prerequisites":["fr.vocabulary.routines-free-time"],"objectives":["Comprendere menu, prezzi e quantità frequenti","Fare richieste semplici in negozio o al bar"],"mastery_evidence":["Completa una transazione semplice","Comprende prezzo e quantità"],"diagnostic_signals":["Confusione numeri/quantità","Conosce il prodotto ma non la formula di richiesta"],"difficulty_levers":["rumore","valuta","numero turni"],"cefr_anchor":"A1","progression_stage":"A1_developing"},{"id":"fr.vocabulary.travel-city","title":"Lessico: viaggio, trasporti e orientamento","strand":"vocabulary","typical_year":2,"priority":"core","prerequisites":["fr.vocabulary.home-town"],"objectives":["Chiedere e comprendere indicazioni","Parlare di trasporti e luoghi pubblici frequenti"],"mastery_evidence":["Segue un percorso semplice","Chiede chiarimento quando necessario"],"diagnostic_signals":["Confusione direzioni","Lessico isolato non trasferito alla mappa"],"difficulty_levers":["mappa","numero svolte","velocità"],"cefr_anchor":"A1","progression_stage":"A1_developing"},{"id":"fr.phonology.rhythm-linking","title":"liaison, élision et rythme","strand":"phonology","typical_year":2,"priority":"core","prerequisites":["fr.phonology.foundation"],"objectives":["Riconoscere fenomeni frequenti del parlato connesso","Migliorare ritmo e intelligibilità nelle frasi"],"mastery_evidence":["Riconosce parole note anche non scandite","Produce gruppi ritmici comprensibili"],"diagnostic_signals":["Comprende solo parole isolate","Pronuncia segmentata ostacola l'ascolto"],"difficulty_levers":["velocità","lunghezza gruppo","familiarità"],"cefr_anchor":"A1","progression_stage":"A1_developing"},{"id":"fr.reading.short-texts","title":"Reading A1: testi brevi quotidiani","strand":"reading","typical_year":2,"priority":"gateway","prerequisites":["fr.reading.basic-info","fr.vocabulary.routines-free-time"],"objectives":["Comprendere messaggi, menu, orari e brevi descrizioni","Ricavare gist e dettagli selezionati"],"mastery_evidence":["Trova informazioni senza leggere tutto con la stessa intensità","Distingue informazione presente e inferenza"],"diagnostic_signals":["Scansione inefficiente","Distrattori lessicali"],"difficulty_levers":["tipo testo","distrattori","tempo"],"cefr_anchor":"A1","progression_stage":"A1_developing"},{"id":"fr.listening.everyday-dialogues","title":"Listening A1: dialoghi quotidiani","strand":"listening","typical_year":2,"priority":"gateway","prerequisites":["fr.listening.basic-info","fr.phonology.rhythm-linking"],"objectives":["Comprendere tema e dettagli pratici di dialoghi semplici","Seguire più turni brevi"],"mastery_evidence":["Ricostruisce chi vuole cosa","Individua orari, prezzi o luoghi"],"diagnostic_signals":["Perde il referente tra turni","Si aggrappa a singola parola"],"difficulty_levers":["numero turni","velocità","distrattori"],"cefr_anchor":"A1","progression_stage":"A1_developing"},{"id":"fr.interaction.transactions","title":"Interazione: transazioni e servizi","strand":"interaction","typical_year":2,"priority":"gateway","prerequisites":["fr.vocabulary.food-shopping","fr.learning.repair-basics"],"objectives":["Fare richieste, reagire alla risposta e chiudere una transazione","Gestire un piccolo problema o alternativa"],"mastery_evidence":["Sostiene uno scambio di più turni","Usa una strategia di riparazione se non comprende"],"diagnostic_signals":["Recita formule senza reagire","Abbandona al primo imprevisto"],"difficulty_levers":["numero turni","imprevisto","supporto"],"cefr_anchor":"A1","progression_stage":"A1_developing"},{"id":"fr.production.past-plan","title":"Produzione orale: esperienza e progetto","strand":"spoken_production","typical_year":2,"priority":"core","prerequisites":["fr.grammar.past-intro","fr.grammar.future-modality"],"objectives":["Raccontare brevemente un'esperienza e descrivere un piano","Collegare 3-4 frasi con marcatori temporali"],"mastery_evidence":["Sequenza comprensibile","Riferimento temporale coerente"],"diagnostic_signals":["Cambio tempo casuale","Frasi non collegate"],"difficulty_levers":["numero eventi","preparazione","lessico"],"cefr_anchor":"A1","progression_stage":"A1_developing"},{"id":"fr.writing.informal-message","title":"Scrittura: messaggio informale e invito","strand":"writing","typical_year":2,"priority":"core","prerequisites":["fr.writing.profile-message","fr.grammar.future-modality"],"objectives":["Scrivere un invito o risposta breve","Indicare quando, dove e che cosa"],"mastery_evidence":["Copre i punti pratici","Usa apertura e chiusura adatte"],"diagnostic_signals":["Manca un dato necessario","Registro incoerente"],"difficulty_levers":["numero vincoli","destinatario","supporto"],"cefr_anchor":"A1","progression_stage":"A1_developing"},{"id":"fr.mediation.key-points","title":"Mediazione: selezionare e riferire punti chiave","strand":"mediation","typical_year":2,"priority":"gateway","prerequisites":["fr.mediation.relay-basic","fr.reading.short-texts"],"objectives":["Riferire 2-3 informazioni utili da un messaggio o avviso","Adattare la quantità di informazione allo scopo"],"mastery_evidence":["Seleziona e ordina i dati","Non copia dettagli irrilevanti"],"diagnostic_signals":["Copia integrale","Omette il dato decisivo"],"difficulty_levers":["numero dati","destinatario","cambio lingua"],"cefr_anchor":"A1","progression_stage":"A1_developing"},{"id":"fr.learning.gist-detail","title":"Strategie di gist e dettaglio","strand":"learning_strategy","typical_year":2,"priority":"core","prerequisites":["fr.reading.short-texts","fr.listening.everyday-dialogues"],"objectives":["Scegliere tra ascolto/lettura globale e ricerca mirata","Prendere note con parole chiave"],"mastery_evidence":["Spiega la strategia usata","Cambia strategia in base alla domanda"],"diagnostic_signals":["Trascrive tutto","Cerca dettagli quando serve il gist"],"difficulty_levers":["tempo","tipo domanda","densità"],"cefr_anchor":"A1","progression_stage":"A1_developing"}],"target_cefr":"A1"}
