{"version":"0.1.0","subject":"italian","school_stage":"middle_school","curriculum_profile":"italy-middle-school-italian-2026-transition","typical_year":2,"sequencing_note":"Sequenza tipica TutorLab, non prescrittiva. Il motore può scendere ai prerequisiti e ritornare all'obiettivo in base alle evidenze.","nodes":[{"id":"ita.oral.listening-inference","title":"Comprensione orale: inferenze e intenzione","strand":"oral","typical_year":2,"priority":"core","prerequisites":["ita.oral.listening-main-info"],"objectives":["Ricavare informazioni implicite semplici","Riconoscere scopo e atteggiamento del parlante da indizi linguistici"],"mastery_evidence":["Giustifica un'inferenza con un indizio","Distingue fatto esplicito e conclusione inferita"],"diagnostic_signals":["Trasforma ipotesi in fatto","Ignora tono e connettivi"],"difficulty_levers":["densità implicita","numero parlanti","registro"]},{"id":"ita.oral.discussion-opinion","title":"Discussione e opinione motivata","strand":"oral","typical_year":2,"priority":"gateway","prerequisites":["ita.oral.basic-discussion"],"objectives":["Esprimere un'opinione con una ragione","Rispondere a un'obiezione senza perdere il tema"],"mastery_evidence":["Collega tesi e motivo","Riprende un'idea altrui prima di controargomentare"],"diagnostic_signals":["Opinione senza motivazione","Replica senza ascolto"],"difficulty_levers":["numero argomenti","controargomento","tempo di preparazione"]},{"id":"ita.reading.expository","title":"Comprendere testi espositivi di studio","strand":"reading","typical_year":2,"priority":"gateway","prerequisites":["ita.reading.instructions-expository"],"objectives":["Riconoscere struttura, concetti e relazioni logiche","Usare titoli, paragrafi e connettivi per orientarsi"],"mastery_evidence":["Costruisce una mappa coerente","Distingue esempio, definizione e spiegazione"],"diagnostic_signals":["Sottolinea quasi tutto","Confonda esempio e idea generale"],"difficulty_levers":["densità concettuale","terminologia","supporti grafici"]},{"id":"ita.reading.noncontinuous","title":"Leggere tabelle, grafici e testi misti","strand":"reading","typical_year":2,"priority":"core","prerequisites":["ita.reading.instructions-expository"],"objectives":["Integrare informazioni da testo, tabella, grafico o infografica","Individuare discrepanze o conferme tra formati"],"mastery_evidence":["Risponde usando più fonti della pagina","Esplicita da quale elemento ricava il dato"],"diagnostic_signals":["Legge un solo formato","Confonda etichetta e valore"],"difficulty_levers":["numero rappresentazioni","scala grafica","inferenza"]},{"id":"ita.reading.inference","title":"Inferenze e significato contestuale nella lettura","strand":"reading","typical_year":2,"priority":"gateway","prerequisites":["ita.reading.narrative-descriptive","ita.vocabulary.word-formation-dictionary"],"objectives":["Dedurre significati e relazioni non esplicite","Distinguere inferenze plausibili da informazioni assenti"],"mastery_evidence":["Cita indizi testuali","Rifiuta conclusioni non sostenute dal testo"],"diagnostic_signals":["Usa conoscenze esterne come prova","Confonda non detto con falso"],"difficulty_levers":["distanza inferenziale","distrattori","polisemia"]},{"id":"ita.writing.expository","title":"Scrivere un testo espositivo","strand":"writing","typical_year":2,"priority":"gateway","prerequisites":["ita.reading.expository","ita.study.notes-summary"],"objectives":["Organizzare informazioni per tema e sottotemi","Usare definizioni, esempi e connettivi esplicativi"],"mastery_evidence":["Il testo segue una gerarchia leggibile","Esempi e definizioni sostengono il tema"],"diagnostic_signals":["Accumula dati senza struttura","Connettivi generici o ripetitivi"],"difficulty_levers":["numero concetti","fonti disponibili","registro"]},{"id":"ita.writing.summary-paraphrase","title":"Riassunto e parafrasi","strand":"writing","typical_year":2,"priority":"core","prerequisites":["ita.study.notes-summary"],"objectives":["Riformulare con parole proprie","Preservare significato e relazioni essenziali riducendo la forma"],"mastery_evidence":["Riduce senza copiare blocchi estesi","Mantiene rapporti causa-effetto o temporali"],"diagnostic_signals":["Sostituisce parole isolate senza riformulare","Introduce opinioni personali"],"difficulty_levers":["compressione","distanza lessicale","tipo testo"]},{"id":"ita.writing.functional","title":"Testi funzionali: email, richiesta, relazione breve","strand":"writing","typical_year":2,"priority":"core","prerequisites":["ita.learning.revision"],"objectives":["Adattare forma e registro allo scopo","Includere tutte le informazioni richieste dalla situazione"],"mastery_evidence":["Il destinatario può agire sulla base del testo","Apertura, corpo e chiusura sono coerenti col genere"],"diagnostic_signals":["Registro incoerente","Manca un'informazione necessaria"],"difficulty_levers":["formalità","numero vincoli","destinatario"]},{"id":"ita.grammar.sentence-functions","title":"Analisi logica e funzioni nella frase","strand":"grammar","typical_year":2,"priority":"gateway","prerequisites":["ita.grammar.simple-sentence"],"objectives":["Riconoscere predicato, soggetto e principali complementi con criterio semantico-sintattico","Distinguere forma e funzione"],"mastery_evidence":["Analizza frasi con ordine non canonico","Motiva almeno i complementi più ambigui"],"diagnostic_signals":["Usa domande meccaniche","Confonda attributo e complemento"],"difficulty_levers":["ordine marcato","ellissi","ambiguità"]},{"id":"ita.grammar.pronouns-connectives","title":"Pronomi e connettivi per coesione","strand":"grammar","typical_year":2,"priority":"core","prerequisites":["ita.grammar.morphology"],"objectives":["Usare pronomi evitando ambiguità","Usare connettivi temporali, causali, avversativi e conclusivi"],"mastery_evidence":["Riconosce referente dei pronomi","Sceglie connettivo coerente con la relazione logica"],"diagnostic_signals":["Referente ambiguo","Connettivo scelto per suono"],"difficulty_levers":["distanza referente","competizione tra connettivi","testo lungo"]},{"id":"ita.grammar.coordination-subordination-intro","title":"Coordinazione e subordinazione: introduzione","strand":"grammar","typical_year":2,"priority":"gateway","prerequisites":["ita.grammar.simple-sentence","ita.grammar.pronouns-connectives"],"objectives":["Distinguere proposizioni coordinate e subordinate","Riconoscere il ruolo dei principali connettivi subordinanti"],"mastery_evidence":["Segmenta periodi brevi","Distingue dipendenza e semplice successione"],"diagnostic_signals":["Conta verbi senza riconoscere legami","Confonda coordinazione e subordinazione"],"difficulty_levers":["numero proposizioni","connettivo implicito/esplicito","ordine"]},{"id":"ita.vocabulary.register-semantics","title":"Relazioni di significato e registro","strand":"vocabulary","typical_year":2,"priority":"core","prerequisites":["ita.vocabulary.word-formation-dictionary"],"objectives":["Riconoscere sinonimia, antonimia, iperonimia e polisemia","Scegliere parole adeguate a registro e contesto"],"mastery_evidence":["Sostituisce parole senza alterare il senso","Distingue colloquiale, neutro e formale"],"diagnostic_signals":["Sinonimo non compatibile","Registro misto"],"difficulty_levers":["polisemia","specificità lessicale","destinatario"]},{"id":"ita.text.genre-analysis","title":"Generi narrativi ed espositivi","strand":"text_analysis","typical_year":2,"priority":"core","prerequisites":["ita.text.narrative-structure","ita.reading.expository"],"objectives":["Riconoscere convenzioni di generi diversi","Collegare scelte strutturali allo scopo del testo"],"mastery_evidence":["Motiva l'attribuzione a un genere","Confronta due testi dello stesso tema ma funzione diversa"],"diagnostic_signals":["Classifica per singolo dettaglio","Ignora lo scopo"],"difficulty_levers":["ibridazione","numero indizi","familiarità"]},{"id":"ita.text.poetry-figures","title":"Poesia: figure retoriche e significato","strand":"text_analysis","typical_year":2,"priority":"supporting","prerequisites":["ita.text.poetry-basics"],"objectives":["Riconoscere similitudine, metafora, personificazione e principali figure sonore","Collegare la figura all'effetto di senso"],"mastery_evidence":["Non si limita a nominare la figura","Propone un'interpretazione sostenuta dal testo"],"diagnostic_signals":["Etichetta senza spiegare","Interpreta simboli senza indizi"],"difficulty_levers":["densità figurativa","ambiguità","contesto"]},{"id":"ita.study.source-synthesis","title":"Sintesi da più fonti semplici","strand":"study_strategy","typical_year":2,"priority":"gateway","prerequisites":["ita.reading.expository","ita.writing.summary-paraphrase"],"objectives":["Confrontare due fonti sullo stesso tema","Unire informazioni senza duplicazioni e distinguendo convergenze/differenze"],"mastery_evidence":["Produce una sintesi organizzata","Segnala almeno una differenza rilevante"],"diagnostic_signals":["Copia le fonti in sequenza","Fonde affermazioni incompatibili"],"difficulty_levers":["numero fonti","coerenza tra fonti","formato"]}]}
