{"version":"0.1.0","subject":"italian","school_stage":"middle_school","curriculum_profile":"italy-middle-school-italian-2026-transition","typical_year":1,"sequencing_note":"Sequenza tipica TutorLab, non prescrittiva. Il motore può scendere ai prerequisiti e ritornare all'obiettivo in base alle evidenze.","nodes":[{"id":"ita.oral.listening-main-info","title":"Comprendere informazioni principali in testi orali","strand":"oral","typical_year":1,"priority":"gateway","prerequisites":[],"objectives":["Individuare tema, informazioni esplicite e sequenza essenziale in un testo orale breve","Prendere appunti minimi durante l'ascolto"],"mastery_evidence":["Ricostruisce correttamente chi, che cosa, dove e quando","Distingue informazione centrale da dettaglio"],"diagnostic_signals":["Ricorda dettagli ma perde il senso globale","Confonda ordine degli eventi"],"difficulty_levers":["densità informativa","assenza di supporto scritto","numero di passaggi"]},{"id":"ita.oral.prepared-exposition","title":"Esposizione orale preparata","strand":"oral","typical_year":1,"priority":"core","prerequisites":["ita.oral.listening-main-info"],"objectives":["Organizzare un breve intervento con apertura, sviluppo e chiusura","Usare lessico comprensibile e segnali di ordine"],"mastery_evidence":["Espone un argomento familiare seguendo una scaletta","Mantiene coerenza senza leggere integralmente"],"diagnostic_signals":["Elenca informazioni senza gerarchia","Dipende dal testo scritto"],"difficulty_levers":["durata","supporto della scaletta","familiarità del tema"]},{"id":"ita.oral.basic-discussion","title":"Interazione e discussione di base","strand":"oral","typical_year":1,"priority":"core","prerequisites":["ita.oral.listening-main-info"],"objectives":["Prendere il turno in modo pertinente","Fare domande e rispondere collegandosi a quanto detto dagli altri"],"mastery_evidence":["Interviene senza cambiare tema","Formula almeno una domanda pertinente"],"diagnostic_signals":["Ripete la propria idea senza ascoltare","Risponde fuori tema"],"difficulty_levers":["numero di interlocutori","grado di disaccordo","preparazione"]},{"id":"ita.reading.narrative-descriptive","title":"Comprendere testi narrativi e descrittivi","strand":"reading","typical_year":1,"priority":"gateway","prerequisites":[],"objectives":["Riconoscere personaggi, ambiente, tempo, eventi e punto di vista essenziale","Distinguere descrizione e narrazione"],"mastery_evidence":["Ricostruisce la sequenza degli eventi","Collega tratti descrittivi al personaggio o luogo corretto"],"diagnostic_signals":["Copia frasi senza comprenderne la funzione","Confonda ordine cronologico e ordine del testo"],"difficulty_levers":["lunghezza testo","presenza di flashback","lessico inferenziale"]},{"id":"ita.reading.instructions-expository","title":"Comprendere istruzioni e testi espositivi semplici","strand":"reading","typical_year":1,"priority":"core","prerequisites":[],"objectives":["Seguire istruzioni in sequenza","Individuare titolo, tema e informazioni chiave di un testo espositivo"],"mastery_evidence":["Esegue o riordina correttamente una procedura","Produce una breve mappa delle informazioni principali"],"diagnostic_signals":["Salta vincoli della consegna","Tratta ogni frase come ugualmente importante"],"difficulty_levers":["numero passaggi","formato continuo/non continuo","termini specifici"]},{"id":"ita.writing.narrative","title":"Scrivere un testo narrativo coerente","strand":"writing","typical_year":1,"priority":"gateway","prerequisites":["ita.reading.narrative-descriptive"],"objectives":["Pianificare situazione iniziale, evento, sviluppo e conclusione","Usare indicatori temporali coerenti"],"mastery_evidence":["Il testo presenta una sequenza comprensibile e completa","I tempi verbali e i connettivi sostengono la cronologia"],"diagnostic_signals":["Eventi giustapposti senza nesso","Cambio casuale dei tempi verbali"],"difficulty_levers":["vincoli narrativi","numero personaggi","grado di autonomia"]},{"id":"ita.writing.descriptive","title":"Scrivere descrizioni organizzate","strand":"writing","typical_year":1,"priority":"core","prerequisites":["ita.reading.narrative-descriptive"],"objectives":["Selezionare dettagli pertinenti","Organizzare la descrizione secondo un criterio spaziale o tematico"],"mastery_evidence":["La descrizione consente di ricostruire il referente","I dettagli seguono un ordine riconoscibile"],"diagnostic_signals":["Elenco casuale di aggettivi","Dettagli non pertinenti"],"difficulty_levers":["referente concreto/astratto","punto di vista","ricchezza lessicale"]},{"id":"ita.grammar.orthography-punctuation","title":"Ortografia e punteggiatura funzionale","strand":"grammar","typical_year":1,"priority":"gateway","prerequisites":[],"objectives":["Applicare convenzioni ortografiche frequenti","Usare punto, virgola, due punti e virgolette per rendere leggibile il testo"],"mastery_evidence":["Corregge errori frequenti in un testo breve","Motiva almeno alcune scelte di punteggiatura"],"diagnostic_signals":["Punteggiatura usata come pausa casuale","Errori ricorrenti su accenti/apostrofi"],"difficulty_levers":["numero errori","testo proprio/altrui","ambiguità sintattica"]},{"id":"ita.grammar.morphology","title":"Riconoscere e usare le parti del discorso","strand":"grammar","typical_year":1,"priority":"gateway","prerequisites":[],"objectives":["Riconoscere nome, articolo, aggettivo, pronome, verbo, avverbio, preposizione e congiunzione","Collegare forma e funzione nel contesto"],"mastery_evidence":["Classifica parole in frasi reali","Spiega l'effetto di una scelta morfologica semplice"],"diagnostic_signals":["Classifica per posizione anziché funzione","Confonda aggettivo e pronome"],"difficulty_levers":["ambiguità contestuale","parole polifunzionali","produzione vs riconoscimento"]},{"id":"ita.grammar.simple-sentence","title":"Struttura della frase semplice","strand":"grammar","typical_year":1,"priority":"gateway","prerequisites":["ita.grammar.morphology"],"objectives":["Riconoscere predicato, soggetto espresso/sottinteso e principali complementi","Distinguere frase minima ed espansioni"],"mastery_evidence":["Analizza frasi semplici non stereotipate","Ricostruisce una frase minima mantenendo il significato essenziale"],"diagnostic_signals":["Cerca il soggetto solo prima del verbo","Tratta ogni sintagma come complemento uguale"],"difficulty_levers":["ordine marcato","soggetto sottinteso","numero espansioni"]},{"id":"ita.vocabulary.word-formation-dictionary","title":"Lessico, formazione delle parole e dizionario","strand":"vocabulary","typical_year":1,"priority":"core","prerequisites":[],"objectives":["Usare contesto, famiglia di parole e dizionario per chiarire significati","Riconoscere derivazione, composizione e alterazione frequenti"],"mastery_evidence":["Formula un significato compatibile con il contesto","Usa il dizionario scegliendo l'accezione pertinente"],"diagnostic_signals":["Sceglie la prima definizione del dizionario","Interpreta prefissi e suffissi meccanicamente"],"difficulty_levers":["polisemia","frequenza lessicale","supporto del contesto"]},{"id":"ita.text.narrative-structure","title":"Struttura e tecniche del testo narrativo","strand":"text_analysis","typical_year":1,"priority":"core","prerequisites":["ita.reading.narrative-descriptive"],"objectives":["Riconoscere sequenze narrative, descrittive e dialogiche","Individuare narratore, tempo e spazio in forma introduttiva"],"mastery_evidence":["Segmenta il testo motivando la funzione delle sequenze","Distingue autore e narratore"],"diagnostic_signals":["Etichetta senza giustificazione","Confonda autore e voce narrante"],"difficulty_levers":["numero di sequenze","narratore interno/esterno","ordine temporale"]},{"id":"ita.text.poetry-basics","title":"Elementi di base del testo poetico","strand":"text_analysis","typical_year":1,"priority":"supporting","prerequisites":[],"objectives":["Riconoscere verso, strofa, rima e alcune figure sonore/semantiche semplici","Cogliere tema e immagini principali"],"mastery_evidence":["Individua elementi formali in un testo breve","Spiega con parole proprie un'immagine poetica"],"diagnostic_signals":["Conta elementi senza interpretarli","Parafrasa parola per parola"],"difficulty_levers":["regolarità metrica","densità figurativa","lessico"]},{"id":"ita.study.notes-summary","title":"Appunti e riassunto essenziale","strand":"study_strategy","typical_year":1,"priority":"gateway","prerequisites":["ita.reading.instructions-expository"],"objectives":["Selezionare idee principali","Ridurre un testo mantenendo ordine logico e informazioni indispensabili"],"mastery_evidence":["Produce appunti gerarchici","Scrive un riassunto più breve senza aggiungere informazioni"],"diagnostic_signals":["Copia intere frasi","Elimina dettagli ma perde l'idea centrale"],"difficulty_levers":["rapporto di compressione","struttura del testo","presenza di titoli"]},{"id":"ita.learning.revision","title":"Revisione guidata del proprio testo","strand":"study_strategy","typical_year":1,"priority":"core","prerequisites":["ita.grammar.orthography-punctuation","ita.writing.narrative"],"objectives":["Rileggere separando contenuto, organizzazione e correttezza","Usare una checklist per correggere errori ricorrenti"],"mastery_evidence":["Individua almeno un problema per ciascun livello","Migliora il testo senza cambiarne arbitrariamente il senso"],"diagnostic_signals":["Corregge solo ortografia","Riscrive senza sapere quale problema sta risolvendo"],"difficulty_levers":["numero criteri","testo proprio/altrui","tempo disponibile"]}]}
